{
  "change_control": {
    "bootstrap_schema_version": "hfx-pipeline-bootstrap-v1",
    "requires_code_review": true,
    "requires_validator_implementation_before_production": true,
    "status_const": "HFX_MASTER_PIPELINE_SYSTEM_READY_NO_FINAL_PIXELS"
  },
  "contract_layer": "hfx_master_pipeline_seal",
  "contract_status": "approved",
  "final_pixel_claim": false,
  "final_pixel_execution": "BLOCKED",
  "generated_by": "kernel/vfx/bootstrap_hfx_pipeline.py",
  "governed_root": "assets/houdini",
  "large_file_loading": "DISABLED",
  "layer_count": 12,
  "layers": [
    "hfx_assetization_layer",
    "hfx_aov_pass_contract_layer",
    "hfx_resource_library_layer",
    "hfx_lookdev_shader_contract_layer",
    "hfx_plate_camera_integration_layer",
    "hfx_render_automation_layer",
    "hfx_comp_automation_layer",
    "hfx_color_management_layer",
    "hfx_review_dailies_layer",
    "hfx_final_pixel_gate_layer",
    "hfx_delivery_package_layer",
    "hfx_master_pipeline_seal"
  ],
  "locked": true,
  "non_goals": [
    "No EXR rendering",
    "No compositing execution",
    "No PBR texture loading",
    "No VDB loading",
    "No HDRI loading",
    "No final-pixel claims"
  ],
  "notes": [
    "Generated by the HFX bootstrapper.",
    "No final-pixel production is authorized by this seal."
  ],
  "real_asset_loading": "DISABLED",
  "schema_version": "hfx-master-pipeline-global-seal-v1",
  "status": "HFX_MASTER_PIPELINE_SYSTEM_READY_NO_FINAL_PIXELS"
}
